text,intent,labels
can you turn msnbc on in the car,play_radio,71
what a sunny day,weather_query,104
Where should I go nearby?,places_near_me,64
would you check and confirm the details please.,general_confirm,30
thanks but i think you have messed up my request.,general_negate,34
tell me about it,qa_definition,75
Your real name please?,realnamequery,79
minimize the lights,iot_hue_lightdim,47
Who are you talking to?,currenthumanquery,20
I was not talking to you,nottalking2u,62
find recent events of the celebrity,general_quirky,36
is it sunny in gonbad now,weather_query,104
I am bored gossip with me,gossip,39
what movies are being shown at the regal cinema,recommendation_movies,82
book a train ticket from los angeles to chicago that goes via miami,transport_ticket,100
You are a very intelligent girl,clever,13
i would like to receive updates about the stock market every day,qa_stock,78
please turn off the wemo plug,iot_wemo_off,51
load up ghost recon wildlands,play_game,66
turn the lights on full bright,iot_hue_lighton,49
which restaurant is there in shivaji nagar,recommendation_locations,81
set the alarm for tomorrow five am,alarm_set,2
what is the month day and year,datetime_query,22
it's too dark i can't even see my hands,iot_hue_lighton,49
note current song as awesome please,music_likeness,57
"Thank you, goodbye",courtesygoodbye,16
volume control mute,volume_control,103
tell me the name of my lists,lists_query,55
send email to dipesh,send_email,84
please change light color to purple,iot_hue_lightchange,46
tell me when taco bell can deliver my dinner,takeaway_query,92
Tell me a joke,jokes,53
daily cases of india,covid_cases,19
today,asking_date,3
repeat the song playing now,music_settings,59
please go to the next episode of the podcast,play_podcasts,70
cancel the alarm that is set for tomorrow at eight am,alarm_remove,1
play candy crush with me,play_game,66
"it's great one, i appreciate it.",general_praise,35
please turn on all the outdoor lights,iot_hue_lighton,49
lower the lights in the living room,iot_hue_lightdim,47
can you pull up the dave ramsey podcast that aired on monday,play_podcasts,70
send an uber to me right now,transport_taxi,99
all lights has to be turned off during the day,iot_hue_lightoff,48
"it was nice one, thanks.",general_praise,35
"that's cool,, olly.",general_praise,35
i want to turn on the blue lights,iot_hue_lighton,49
what day is it on fifth december,datetime_query,22
My user is Bella,greetingresponse,42
what is the update on stock market,tell_me_news,95
check item five on my to do list,lists_query,55
i would like you to check what last said please.,general_confirm,30
what's on my todo list,lists_query,55
Open the pod bay door,podbaydoor,72
What do you think I am?,currenthumanquery,20
i'd like you just stop.,general_commandstop,29
what is the day of the week,asking_date,3
Hya there,greeting,41
get a me a train ticket to milwaukee from chicago on sunday morning,transport_ticket,100
can you just stop it please.,general_commandstop,29
i want to bright the room more,iot_hue_lightup,50
could you get john's email address for me,email_querycontact,26
prove you have a conscious,selfaware,83
send whatsapp message,send_whatsapp_message,85
send tweet to united airlines i'm angry you lost my bags,social_post,87
day before tomorrow,asking_date,3
more volume please,audio_volume_up,8
Who are you?,namequery,60
dubai marriage,general_quirky,36
what is the traffic like this morning,transport_traffic,101
please decrease the volume of this song,audio_volume_up,8
You are a very intelligent girl,clever,13
play on youtube,play_on_youtube,69
turn on wemo,iot_wemo_on,52
i want to listen to the podcast of the super bowl this past year,play_podcasts,70
Do you know any jokes,jokes,53
send email to dipesh,send_email,84
What services do you offer?,what_can_you_do,105
volume control increase,volume_control,103
check internet speed of safari,check_internet_speed,12
i need you to convert nine am cst to est time,datetime_convert,21
yeap that's correct.,general_affirm,28
play anything by cat stevens and i'll be happy,play_music,68
prove you have a conscious,selfaware,83
how long to get to work,transport_traffic,101
do i have any alarms for tomorrow morning,alarm_query,0
Wasn't meant for you,nottalking2u,62
Why,podbaydoorresponse,73
screen shot,take_screenshot,90
what are the traffic conditions currently,transport_traffic,101
please can you check and confirm the details.,general_confirm,30
start the robot vacuum cleaner,iot_cleaning,44
please turn off the wemo plug socket,iot_wemo_off,51
add apahelp@yahoo dot com to my contacts,email_addcontact,24
what's playing at brea plaza five,recommendation_movies,82
send whatsapp message to 9898982565,send_whatsapp_message,85
what time is it now,asking_time,4
bring the lights down a bit,iot_hue_lightdim,47
call eastwind and order lomaine to go,takeaway_order,91
what kind of lists do i have saved,lists_query,55
the wemo plug should be turned off on,iot_wemo_off,51
Can you see anyone in the camera?,whoami,106
please do not respond,audio_volume_mute,7
tell me news,tell_me_news,95
i want to and my email address,email_addcontact,24
play pacman game with me,play_games,67
tell me about tomorrow,tell_me_about,93
adjust the light,iot_hue_lightchange,46
hi how are you,greet_and_general_check_in,40
send the following email to bro hi come down for dinner tonight,email_sendemail,27
i am not clear about last sentence.,general_explain,32
answer is confirmed.,general_affirm,28
open website github.com,open_website,63
play let me love you by ariana grande,play_music,68
reply to erins email by saying i will be on time,email_sendemail,27
Tell me your name?,namequery,60
screen shot now,take_screenshot,90
What can I call you?,namequery,60
I am Bella,greetingresponse,42
What can I call you?,namequery,60
Great thanks! I am Bella,courtesygreetingresponse,18
is a peso worth more than a dollar,qa_currency,74
play my bookmarked audiobook,play_audiobook,65
what is traffic,transport_traffic,101
capture photo of <name>,click_photo,14
twat,swearing,89
You are a very intelligent girl,clever,13
fetch me the phone number of alexander,email_querycontact,26
Quiet,shutup,86
please clear out my calendar completely,calendar_remove,10
play pride and prejudice,play_audiobook,65
"Thanks for the help, goodbye",courtesygoodbye,16
show me nearby musical events,recommendation_events,80
check internet speed of edge,check_internet_speed,12
how much do you know about me,general_quirky,36
what is joe joe's home address,email_querycontact,26
can you eat sweet potato greens raw,cooking_recipe,15
what are the lyrics to this song playing,music_query,58
Will you open the pod bay door please,podbaydoor,72
turn down media volume,audio_volume_down,6
make the room blue,iot_hue_lightchange,46
olly what songs have i listened to at least ten times,music_query,58
remove my to do list,lists_remove,56
it's perfect.,general_affirm,28
what is time now in california,datetime_query,22
what johncena do,qa_factoid,76
play bbc radio,play_radio,71
Do you see anyone in the camera?,whoami,106
i would like to know the traffic condition,transport_traffic,101
remove vegetables from the list,lists_remove,56
Hello,greeting,41
"olly that is enough, just cancel it.",general_commandstop,29
Do you understand what I am saying,understandquery,102
can you read me my lists,lists_query,55
Can you tell me the best places nearby?,places_near_me,64
send whatsapp message,send_whatsapp_message,85
what is the name of that song,music_query,58
turn off the light in the bathroom,iot_hue_lightoff,48
open website facebook.com,open_website,63
add this song to my favorite list,music_likeness,57
speak quieter,audio_volume_down,6
what type of cheese do i need for my enchiladas,cooking_recipe,15
add to calendar may two is mary's birthday repeat every year,calendar_set,11
give me current information about traffic at central park road,transport_traffic,101
rewind button,play_podcasts,70
check all cab companies and get a time booked for three pm,transport_taxi,99
define the word novel,qa_definition,75
open website stackoverflow.com,open_website,63
tell me about my business,tell_me_about,93
Can you prove you are self aware,selfaware,83
Do you get me,understandquery,102
What are the closest places to me?,places_near_me,64
will you please get the coffee machine to make some coffee,iot_coffee,45
What is my name?,currenthumanquery,20
tell me joe joe's home address,email_querycontact,26
raise the volume of the current music,audio_volume_up,8
is warren buffet is investing in my listed stocks,qa_stock,78
please book a taxi for me,transport_taxi,99
turn the lights on full bright,iot_hue_lighton,49
prove you have a conscious,selfaware,83
tell me the current dollar ratio for the us and canada,qa_currency,74
Comprendo,understandquery,102
turn off wemo plug in game room,iot_wemo_off,51
dim lights,iot_hue_lightdim,47
how to calculate trigonametry,qa_maths,77
check internet speed,check_internet_speed,12
save this songs genre for me,music_likeness,57
what pubs are close,recommendation_locations,81
i'd like to hear what you have said again.,general_repeat,37
daily cases of india,covid_cases,19
Time,timequery,97
what time is it day before tomorrow,asking_time,4
how expensive is google stock,qa_stock,78
Clever girl,clever,13
please check my playlists for jazz music,music_settings,59
could you say one more time please.,general_repeat,37
send email to dipesh,send_email,84
capture selfie,click_photo,14
Good thanks! I am Adam,courtesygreetingresponse,18
Do you know what time it is?,timequery,97
screen shot now,take_screenshot,90
will you do it again please.,general_repeat,37
clarify further on that to me please.,general_explain,32
get coffee maker started for a fresh cup,iot_coffee,45
i am bored what can i do today,i_am_bored,43
Do you understand what I am saying,understandquery,102
whats around,recommendation_locations,81
please find the most popular store in the area,recommendation_locations,81
tell me it one more time again please.,general_repeat,37
mute for the next hour please,audio_volume_mute,7
how much is remaining after subtracting four from eight,qa_maths,77
what is the time difference between eastern and pacific,datetime_convert,21
please clean my calendar,calendar_remove,10
turn off the bathroom light,iot_hue_lightoff,48
download youtube video hd of,download_youtube_video,23
event remove,calendar_remove,10
please can you check and confirm last thing i said.,general_confirm,30
can i get the directions to the nearest bar,transport_query,98
one more again please.,general_repeat,37
OK thank you,thanks,96
make the bedroom lights light blue,iot_hue_lightchange,46
please play the newest podcast,play_podcasts,70
what is the day on twenty third march,datetime_query,22
what food is good,cooking_recipe,15
"that's all, just cancel it.",general_commandstop,29
send whatsapp message about <name>,send_whatsapp_message,85
report the time in miami,datetime_query,22
keep that song for when i need cheering up,music_likeness,57
Do you get me,understandquery,102
please lower the lights,iot_hue_lightdim,47
yeap you've gotten that correcly.,general_affirm,28
can you speak it again please.,general_repeat,37
please once again rephrase me about what you have said.,general_explain,32
Great thanks! This is Bella,courtesygreetingresponse,18
turn off the alarm for tomorrow morning,alarm_remove,1
i am bored what can i do today,i_am_bored,43
thursday at three pm there is a teachers meeting i need to be reminded of,calendar_set,11
Tell me some more gossip,gossip,39
where is the closest sweet frog,recommendation_locations,81
twat,swearing,89
I have some great news for you,tell_me_news,95
turn off shuffle,music_settings,59
tell me about my college,tell_me_about,93
please delete this event,calendar_remove,10
i would like you check details please.,general_confirm,30
Know what I mean,understandquery,102
what is the weather like now today,asking_weather,5
is there any grocery nearby,recommendation_locations,81
recommend a movie playing in me area,recommendation_movies,82
sorry but you have messed up the command.,general_negate,34
display nearby places,recommendation_locations,81
Hola how are you?,courtesygreeting,17
would you do it again please.,general_repeat,37
open website twitter.com,open_website,63
it doesn't matter to me.,general_dontcare,31
please remove the alarm set for wednesday called kickball,alarm_remove,1
make the light more visible,iot_hue_lightup,50
Your real name?,realnamequery,79
let me know the list,lists_query,55
switch wemo plug socket off,iot_wemo_off,51
please turn the lights off,iot_hue_lightoff,48
send whatsapp message,send_whatsapp_message,85
color the lights red,iot_hue_lightchange,46
how much is one american dollars worth in england,qa_currency,74
what can you do,what_can_you_do,105
i like music,music_likeness,57
Will you open the pod bay door please,podbaydoor,72
start reading fifty shades of grey from chapter four,play_audiobook,65
raise the light,iot_hue_lightup,50
Open the pod bay door,podbaydoor,72
turn off the wemo plug,iot_wemo_off,51
list shops in douglasville ga,recommendation_locations,81
What's your real name?,realnamequery,79
open harrypotter audiobook and play from last played,play_audiobook,65
lower the volume ten percent,audio_volume_down,6
What is your real name please?,realnamequery,79
please could you tell me if george's geek restaurant can i order takeaway from there,takeaway_query,92
Will you open the pod bay door please,podbaydoor,72
Good thanks! It is Adam,courtesygreetingresponse,18
olly skip two songs,music_settings,59
put that song in my favourite list,music_likeness,57
place an order for a combo platter from china buffet,takeaway_order,91
Wasn't speaking to you,nottalking2u,62
set an alarm for seven am,alarm_set,2
"wouldn't know, olly.",general_dontcare,31
please find the radio station currently playing howard stern,play_radio,71
how many yen for each dollar,qa_currency,74
do i have a date for tonight,calendar_query,9
turn off the bathroom lights,iot_hue_lightoff,48
Why not,podbaydoorresponse,73
check internet speed of safari,check_internet_speed,12
Clever girl,clever,13
what's the sum of the two numbers four and six,qa_maths,77
send an email to qerwerq@hotmail dot com,email_sendemail,27
Will you open the pod bay door please,podbaydoor,72
make me laugh,tell_me_joke,94
Do you know any jokes,jokes,53
what are the next three alarms set to go off,alarm_query,0
is my reminder alarm set for dance class,alarm_query,0
multiply one thousand by twelve,qa_maths,77
how do i dial sarah,email_querycontact,26
please check and repeat this song one time more,music_settings,59
Bye,goodbye,38
switch on the wemo plug,iot_wemo_on,52
tell me news day after tomorrow,tell_me_news,95
download youtube video of minecraft,download_youtube_video,23
download youtube video of <name>,download_youtube_video,23
please reserve the next taxi a nine am,transport_taxi,99
check internet speed,check_internet_speed,12
Tell me a joke,jokes,53
cancel list,lists_remove,56
please olly put on multi colored lightning in my apartment set for festival diwali,iot_hue_lightup,50
turn room light off,iot_hue_lightoff,48
Do you know what time it is?,timequery,97
covid confirmed cases,covid_cases,19
please indicate the opening price of fra stock,qa_stock,78
i'd like to play uno with you,play_game,66
what time is it,asking_time,4
i am bored,i_am_bored,43
can you tell me the contact information of jo,email_querycontact,26
please play clash of clans,play_game,66
good news for economy,tell_me_news,95
OK thank you,thanks,96
screen shot,take_screenshot,90
Hola how are you?,courtesygreeting,17
Shut up,shutup,86
may i ask you to dim the lights,iot_hue_lightdim,47
send whatsapp message about <name>,send_whatsapp_message,85
What actions can you perform?,what_can_you_do,105
please add tom to my contact list,email_addcontact,24
i want to hear program one on lastfm,play_radio,71
Tell me a joke,jokes,53
please show me a list of entertainment options in my area,recommendation_events,80
please let me know the exchange rate between indian rupees and us,qa_currency,74
do i have a sales meeting today,calendar_query,9
please read out all the alarms that are set,alarm_query,0
You are a genious,clever,13
please open and play chess with me,play_game,66
hey put carrots on that,lists_createoradd,54
send email to dipesh,send_email,84
open train ticket app,transport_ticket,100
tell me about tomorrow,tell_me_about,93
how old is cher,qa_factoid,76
call pf chang's to order me egg foo young,takeaway_order,91
hey go from off to on my vacuum in five minutes,iot_cleaning,44
Can you tell me the time?,timequery,97
i need you to remove item s from my list,lists_remove,56
You are a very clever girl,clever,13
Who am I please,whoami,106
Do you understand what I am saying,understandquery,102
set alarm at two am,alarm_set,2
is the alarm to the backdoor set and ready to go,alarm_query,0
I am bored gossip with me,gossip,39
tell me a joke about getting a first,tell_me_joke,94
lights turn off,iot_hue_lightoff,48
open chess app and begin game,play_game,66
places near me,places_near_me,64
convert eight thirty from gtm four to g. m. t. five thirty,datetime_convert,21
fuck off,swearing,89
put classic rock on,play_music,68
covid cases,covid_cases,19
"s1, explain more on your response.",general_explain,32
what is the time in india when the time in us is twelve pm,datetime_convert,21
cancel all alarms,alarm_remove,1
Hello,greeting,41
open website stackoverflow.com,open_website,63
I was not talking to you,nottalking2u,62
which place has more traffic,transport_traffic,101
please will you just cancel.,general_commandstop,29
today,asking_date,3
adjust media volume up,audio_volume_up,8
show times for nearest theater,recommendation_movies,82
i need more light,iot_hue_lightup,50
i need some coffee,iot_coffee,45
olly would you please shut up.,general_commandstop,29
remove list item,lists_remove,56
save that email as a new contact,email_addcontact,24
what events do i have scheduled today,calendar_query,9
which film the music comes from what is the name of the music,music_query,58
decrease the volume to ten,audio_volume_down,6
Hi there,greeting,41
good day,goodbye,38
day before tomorrow,asking_date,3
Great thanks! This is Bella,courtesygreetingresponse,18
tell me a fun joke,tell_me_joke,94
click selfie of,click_photo,14
call golden taxi to pick me up at seven pm today,transport_taxi,99
What are your functions?,what_can_you_do,105
npr ted talks,play_podcasts,70
i would like it to be able to compute answer from search results like wolfram alpha does,general_quirky,36
please turn up the volume,audio_volume_up,8
time to hear me some blake shelton,play_music,68
weather report of the week,weather_query,104
Who am I please,whoami,106
send email to,send_email,84
please put this playlist on shuffle,music_settings,59
could you please check the traffic to our home,transport_traffic,101
covid cases of india past 48 hours,covid_cases,19
Do you know what time it is?,timequery,97
"it was amazing, olly.",general_praise,35
change my light color to yellow,iot_hue_lightchange,46
explain further.,general_explain,32
what is the temperature right now in new york,qa_factoid,76
what is the square root of one hundred and forty eight thousand five hundred and eighty seven,qa_maths,77
Good thanks! It is Adam,courtesygreetingresponse,18
delete alarm,alarm_remove,1
it is dark,iot_hue_lighton,49
take screenshot,take_screenshot,90
good evening,goodbye,38
play bad guy on youtube,play_on_youtube,69
send whatsapp message,send_whatsapp_message,85
Can you prove you are self-aware,selfaware,83
play games,play_games,67
go to the list and remove item,lists_remove,56
great song for the commute,music_likeness,57
turn off my bedside lamp please,iot_hue_lightoff,48
please tell me it once again.,general_repeat,37
please pause the song,audio_volume_mute,7
hey i need you to make a list of cricket players of indian team who played for the international team in two thousand and fourteen,lists_createoradd,54
delete everything on my calendar for the next two weeks,calendar_remove,10
is mr pizza on skip the dishes,takeaway_query,92
Do you understand what I am saying,understandquery,102
find list and remove apple,lists_remove,56
Can you prove you are self aware,selfaware,83
tell me some funny joke to laugh,general_joke,33
check internet speed of safari,check_internet_speed,12
the latest climate and weather news,news_query,61
remove item three,lists_remove,56
what is john doe's address,email_querycontact,26
fuck off,swearing,89
i want you to go to hot one hundred and five on the radio,play_radio,71
olly i'd like you just cancel it.,general_commandstop,29
what ingredient can be used to replace white wine,cooking_recipe,15
what is the weather day after tomorrow,asking_weather,5
turn the lamp off,iot_hue_lightoff,48
tell me a fun joke,tell_me_joke,94
please would you cancel it.,general_commandstop,29
when my takeaway order will arrive,takeaway_query,92
good evening,goodbye,38
What do your friends call you?,namequery,60
play on youtube,play_on_youtube,69
add wash jeans to laundry list,lists_createoradd,54
tell me news day after tomorrow,tell_me_news,95
twat,swearing,89
what's my stock fluctuations,qa_stock,78
talk quieter please,audio_volume_down,6
doesn't matter.,general_dontcare,31
turn on repeat,music_settings,59
places near me to eat today,places_near_me,64
hey there,greet_and_general_check_in,40
check internet speed of safari,check_internet_speed,12
could you tell me it one more time please.,general_repeat,37
What's your real name?,realnamequery,79
send me the last list uploaded,lists_query,55
where is the nearest italian restaurant,recommendation_locations,81
touch the mute button,audio_volume_mute,7
play games of xyz 32 bit,play_games,67
what is laptop,qa_definition,75
"Thank you, goodbye",courtesygoodbye,16
status of weather,weather_query,104
Thanks,thanks,96
go near vacuum cleaner,iot_cleaning,44
i had a long hard day,general_quirky,36
turn off the light in the kitchen,iot_hue_lightoff,48
what is the time difference between here and japan,datetime_convert,21
send email about,send_email,84
i need more milk,lists_createoradd,54
tomorrow,asking_date,3
what is elvis favorite ride,qa_factoid,76
"Thank you, bye",courtesygoodbye,16
tell me when my next doctors appointment is,calendar_set,11
google uber,transport_taxi,99
covid cases of india past 48 hours,covid_cases,19
cancel my birthday party,calendar_remove,10
click photo,click_photo,14
open website wikipedia.com,open_website,63
call the restaurant to see if the delivery is on the way,takeaway_query,92
remind me to take out the trash,calendar_set,11
turn on repeat,music_settings,59
raise the volume of the current music,audio_volume_up,8
what is the weather like now,asking_weather,5
can you please further explain me about that.,general_explain,32
I am Bella,greetingresponse,42
dismiss my next event,calendar_remove,10
send email to xyz@gmail.com,send_email,84
please make me nice coffee,iot_coffee,45
remove dinner with mike from my calendar,calendar_remove,10
what's a good movie that's out right now,recommendation_movies,82
tell me a joke today,tell_me_joke,94
play games of c,play_games,67
tell me a fun joke,tell_me_joke,94
Who am I please,whoami,106
could you once again rephrase me about your answers.,general_explain,32
what is apple's stock,qa_stock,78
current time please,datetime_query,22
please mute yourself,audio_volume_mute,7
play on youtube,play_on_youtube,69
clear the dust and then on the cleaner,iot_cleaning,44
Tell me some gossip,gossip,39
i'd like you check what i last said please.,general_confirm,30
how much is the dollar worth compared to the euro,qa_currency,74
"i do not know, olly.",general_dontcare,31
What do you think I am?,currenthumanquery,20
what apple trading at,qa_stock,78
go and make me a coffee,iot_coffee,45
i'm in the mood to order takeaway,takeaway_order,91
open website github.com,open_website,63
what is the time in canada now,datetime_query,22
download youtube video of <name>,download_youtube_video,23
play maroon five playlist,play_music,68
the wemo plug should be turned off on,iot_wemo_off,51
how much is one hundred and thirty six plus three hundred and eighty seven,qa_maths,77
please play a podcast,play_podcasts,70
how many miles in five kilometers,qa_maths,77
play games of xyz 32 bit,play_games,67
count the number of food items on the list,lists_query,55
what time is it day before tomorrow,asking_time,4
find me a train ticket next monday to new york city,transport_ticket,100
What are some nearby locations?,places_near_me,64
what's the funniest joke you know,general_joke,33
"Thank you, bye",courtesygoodbye,16
tell me about my life,tell_me_about,93
Comprendo,understandquery,102
have a moan at easyjet,social_post,87
play episode ten in the podcast,play_podcasts,70
taxi uber,transport_taxi,99
Why not,podbaydoorresponse,73
turn off the alarm for tomorrow morning,alarm_remove,1
uh what does the current date happen to be,datetime_query,22
Thanks good bye,courtesygoodbye,16
i asked for something else.,general_negate,34
buy a train ticket to cleveland for april fourteenth,transport_ticket,100
play games of gcc,play_games,67
play bad guy on youtube,play_on_youtube,69
Tell me a joke,jokes,53
volume control unmute,volume_control,103
please explain me about your words once again.,general_explain,32
beg your pardon.,general_repeat,37
please remove apples from my grocery list,lists_remove,56
what is tomorrows date,datetime_query,22
book uber from my home,transport_taxi,99
please lower the volume,audio_volume_down,6
Your real name?,realnamequery,79
write an email to luke asking how the weather will be this coming week,email_sendemail,27
play on youtube,play_on_youtube,69
my coffee is cold please make more coffee,iot_coffee,45
Tell me a joke,jokes,53
remove eggs for the shopping list,lists_remove,56
i don't mind for whatever.,general_dontcare,31
