text,intent,labels
can you make coffee,iot_coffee,45
next i want to hear shinedown,play_music,68
set a reminder for fifteen minutes to change laundry loads,calendar_set,11
please turn on my door lock,iot_wemo_on,52
play any country music station,play_radio,71
Who do you think I am?,currenthumanquery,20
Clever girl,clever,13
send email to dipesh,send_email,84
I was not talking to you,nottalking2u,62
is alex saved in my contacts list,email_querycontact,26
check my twitter notification,social_query,88
hello there,greet_and_general_check_in,40
ask a restaurant in me area,recommendation_locations,81
outlet off,iot_wemo_off,51
can you continue audiobook the circle,play_audiobook,65
can you send a tweet to lif saying that their app crashed,social_post,87
order food,takeaway_order,91
define love without invoking the term love,qa_definition,75
take away my alarm for tomorrow at four thirty am,alarm_remove,1
check internet speed of safari,check_internet_speed,12
make an alarm for three pm,alarm_set,2
daily cases of india,covid_cases,19
find my next event and delete it please,calendar_remove,10
volume control mute,volume_control,103
check internet speed of,check_internet_speed,12
what's going on in the world,tell_me_news,95
give me the exchange rate between united states dollar and japanese yen,qa_currency,74
is anyone likes my latest photo,social_query,88
Do you know what time it is?,timequery,97
play magic run after thirty min,play_audiobook,65
send email to <name>,send_email,84
i could not quite catch up with you.,general_explain,32
i do not get the last sentence.,general_explain,32
play bad guy on youtube,play_on_youtube,69
download youtube video of minecraft,download_youtube_video,23
Is it going to snow,asking_weather,5
"excellent job, you have done well.",general_praise,35
please find the recipe for meatballs,cooking_recipe,15
open inbox,email_query,25
would you tell me that once again.,general_repeat,37
volume control increase by 10,volume_control,103
what is the time,asking_time,4
how many things do i have planned tonight,calendar_query,9
click selfie of,click_photo,14
does paradise has takeaway,takeaway_query,92
let's do math,qa_maths,77
that song is my favorite,music_likeness,57
i bought pre season baseball tickets,general_quirky,36
My user is Adam,greetingresponse,42
book an uber for one hour from now,transport_taxi,99
Tell me some more gossip,gossip,39
covid cases,covid_cases,19
Do you see me?,whoami,106
can you tell me a good place to eat,recommendation_locations,81
delete my calendar,calendar_remove,10
find transportation to rome,transport_taxi,99
give me the reminders,calendar_query,9
continue from where we left off in divergent,play_audiobook,65
send whatsapp message about <name>,send_whatsapp_message,85
Do you get me,understandquery,102
What services do you offer?,what_can_you_do,105
how many work contacts are in my phone book,email_querycontact,26
have no idea regarding to which to choose.,general_dontcare,31
Hi there,greeting,41
what is the traffic like now,transport_traffic,101
Tell me some gossip,gossip,39
can i get delivery from this restaurant,takeaway_query,92
tell me fun joke,tell_me_joke,94
whats was the value of x if x plus two equals five,qa_maths,77
Do you understand what I am saying,understandquery,102
remove my bedtime alarm,alarm_remove,1
take screenshot,take_screenshot,90
Hello there,greeting,41
Will you open the pod bay door,podbaydoor,72
make a contrast one,iot_hue_lightchange,46
click photo,click_photo,14
what is the date and month today,datetime_query,22
let me know today's date in american format,datetime_query,22
order me chinese food,takeaway_order,91
how many hours difference is hong kong from new york city,datetime_convert,21
lower the lights in the living room,iot_hue_lightdim,47
please activate my vacuum cleaner,iot_cleaning,44
could you please further elaborate me about what you have just said.,general_explain,32
Wasn't meant for you,nottalking2u,62
delete the list,lists_remove,56
Hello how are you?,courtesygreeting,17
Who are you?,namequery,60
too private,general_quirky,36
i want a coffee,iot_coffee,45
what is the current time in london,datetime_query,22
define session,qa_definition,75
have i received any emails from beth,email_query,25
what are the show times of logan,recommendation_movies,82
what is the day,asking_date,3
i am bored today what can i do,i_am_bored,43
Can you control the volume?,volume_control,103
take screenshot,take_screenshot,90
show chicken tikka recipe,cooking_recipe,15
what time is it,asking_time,4
hold,play_audiobook,65
Who am I please,whoami,106
what is three plus four,qa_maths,77
Why can you not open the pod bay door,podbaydoorresponse,73
can you mute when i am not home,audio_volume_mute,7
Open the pod bay door,podbaydoor,72
"Thank you, goodbye",courtesygoodbye,16
"hmm, it is not what i wanted.",general_negate,34
how much would it cost to buy stock in apple,qa_stock,78
play news in fm,play_radio,71
could you check that please.,general_confirm,30
send tweet to wallmart,social_post,87
what is the weather like day after tomorrow,asking_weather,5
what time is it day before tomorrow,asking_time,4
open radio,play_radio,71
how long do i chill an icebo pie,cooking_recipe,15
song next please,play_music,68
Hello hope you are doing well?,courtesygreeting,17
tell me news tomorrow,tell_me_news,95
take screenshot,take_screenshot,90
i'd like to listen to my favorite morning show in the car on the way to work please,play_radio,71
please tell me latest video going viral on twitter for topic narendra modi,social_query,88
please lower the lights,iot_hue_lightdim,47
click selfie of,click_photo,14
let's try it again.,general_repeat,37
how do you make cookies,cooking_recipe,15
can you empty my calendar,calendar_remove,10
be mute,audio_volume_mute,7
lower battery consumption to save setting,music_settings,59
yes you got answer correcly.,general_affirm,28
does shibaru sushi deliver,takeaway_query,92
i would love a less bright up room,iot_hue_lightdim,47
whats the travel time from here to dallas by train,transport_query,98
isn't it a lovely song please save this for me,music_likeness,57
how would the volkswagen golf car look like,qa_definition,75
what's the latest on the travel ban,news_query,61
what is the time in india when the time in us is twelve pm,datetime_convert,21
could you fix me some coffee,iot_coffee,45
is it colder than yesterday,weather_query,104
send email to nancy about tomorrow's work party details,email_sendemail,27
show me all of my active alarms,alarm_query,0
what is the current exchange rate of euro to dollar,qa_currency,74
Quiet,shutup,86
please help me turn on the robot vacuum cleaner,iot_cleaning,44
what's june's address nowadays,email_querycontact,26
what is the name of this song,music_query,58
olly skip two songs,music_settings,59
music change,music_settings,59
What can you assist me with?,what_can_you_do,105
what is the cooking time for boiled eggs,cooking_recipe,15
what is the price for marvel,qa_stock,78
What is your name?,namequery,60
what did you mean by saying it.,general_explain,32
yeah you have got my instructions right.,general_affirm,28
"that's helpful, i appreciate it.",general_praise,35
turn off the nearest light to me,iot_hue_lightoff,48
where is a good wine bar near me,recommendation_locations,81
what time is it day before tomorrow,asking_time,4
complain about walmart service,social_post,87
tell me news tomorrow,tell_me_news,95
stop repeating this song,music_settings,59
Do you see me?,whoami,106
is there any event around,recommendation_events,80
tell me a joke,tell_me_joke,94
What are your functionalities?,what_can_you_do,105
let us do it again please.,general_repeat,37
turn off the light in the living room,iot_hue_lightoff,48
has the weather changed for wednesday at all,weather_query,104
Hello,greeting,41
download youtube video of,download_youtube_video,23
Enough talking,shutup,86
Great thanks! This is Bella,courtesygreetingresponse,18
tell me a joke about asia,tell_me_joke,94
Tell me a joke,jokes,53
send email to <name>,send_email,84
Clever girl,clever,13
i really enjoy rock and roll,music_likeness,57
good evening,goodbye,38
would you play some music please,play_music,68
play song over the rainbow,play_music,68
i am bored today,i_am_bored,43
how much is twenty argentinian pesos in pounds,qa_currency,74
please lower the lights a little bit,iot_hue_lightdim,47
when is the next train leaving for austin,transport_query,98
hi olly please remove the birthday event on coming sunday,calendar_remove,10
play baseball with me,play_games,67
doesn't really matter for me.,general_dontcare,31
Wasn't meant for you,nottalking2u,62
please check the traffic to the home,transport_traffic,101
Good thanks! This is Adam,courtesygreetingresponse,18
repeating event meeting on mondays,calendar_set,11
You are a very intelligent girl,clever,13
fuck off,swearing,89
down the light power,iot_hue_lightdim,47
check my list,lists_query,55
hey there,greet_and_general_check_in,40
what is an alternative to flour,cooking_recipe,15
start music,play_music,68
"Thank you, goodbye",courtesygoodbye,16
call dad,email_querycontact,26
i want to hear what said again.,general_repeat,37
Not talking to you,nottalking2u,62
thanks but i think this was not the correct command.,general_negate,34
Tell me a joke,jokes,53
get the cleaning on,iot_cleaning,44
what's the good news?,tell_me_news,95
turn on hall lights,iot_hue_lighton,49
tell me which stocks were the biggest gainers in stock market nasdaq today,qa_stock,78
What do your friends call you?,namequery,60
lower the brightness,iot_hue_lightdim,47
play the song title,play_music,68
What do you think I am?,currenthumanquery,20
what's the funniest joke you know,general_joke,33
Please be quiet,shutup,86
what time is it day before tomorrow,asking_time,4
send email to <name>,send_email,84
switch wemo plug socket off,iot_wemo_off,51
What can you help me with?,what_can_you_do,105
can you send an email for me to a new email address,email_sendemail,27
plays the podcast from the beginning,play_podcasts,70
send whatsapp message about <name>,send_whatsapp_message,85
what's going around in the world these days,news_query,61
i need the exchange rate for the us dollar and the euro,qa_currency,74
hey turn on disco lights in my apartment and let the party begin,iot_hue_lighton,49
vacuum the dining room,iot_cleaning,44
what's one plus one,qa_maths,77
Tell me some gossip,gossip,39
find game,play_game,66
what is the weather today,asking_weather,5
Great thanks! This is Bella,courtesygreetingresponse,18
What do you think I am?,currenthumanquery,20
set the settings to mute,audio_volume_mute,7
what is the weather today,asking_weather,5
thanks for your answers.,general_praise,35
Well why not,podbaydoorresponse,73
repeat song number ten from main list,music_settings,59
confirm a travel ticket to german,transport_ticket,100
play bad guy on youtube,play_on_youtube,69
on the plug,iot_wemo_on,52
fuck off,swearing,89
"that's useful, thank you very much.",general_praise,35
can you tell me which movie is going on in the nearby multiplex,recommendation_movies,82
please increase volume in music player,audio_volume_up,8
please look up local restaurants that are open now,recommendation_locations,81
how many alarms have i set,alarm_query,0
good evening,goodbye,38
what are the latest tweets from the new york times,social_query,88
bye,goodbye,38
what is the definition of session,qa_definition,75
Hello,greeting,41
play happy playlist next,play_music,68
are there any events going on in milan,recommendation_events,80
if it is twelve hours ahead of eastern standard centaur time what's the time in the philippines now,datetime_convert,21
clean the floor please,iot_cleaning,44
Who are you?,namequery,60
select shuffle all,music_settings,59
please reduce the speaker volume,audio_volume_down,6
tell me a joke about the north korea nuclear summit,tell_me_joke,94
i want to listen to the new sam harris episode,play_radio,71
add car service to my list of things to do today,lists_createoradd,54
i want to raise the light,iot_hue_lightup,50
switch to eastern time zone,datetime_convert,21
Identify me,whoami,106
can you give me the time in this time zone,datetime_query,22
fuck off,swearing,89
Comprendo,understandquery,102
could you speak once more please.,general_repeat,37
Who do you think I am?,currenthumanquery,20
great response to command.,general_affirm,28
Open the pod bay door,podbaydoor,72
Tell me some more gossip,gossip,39
please give me the latest feed updates,social_query,88
what's good news,tell_me_news,95
please let's do it again.,general_repeat,37
"Thank you, bye",courtesygoodbye,16
book a cab which have cheapest price,transport_taxi,99
anything will be ok with me.,general_dontcare,31
whats the time now,datetime_query,22
buy a train ticket from lakeland florida to new york,transport_ticket,100
show a new list,lists_createoradd,54
Open the pod bay door,podbaydoor,72
send email to <name> about <name>,send_email,84
socket off,iot_wemo_off,51
if it is a consumer good then what is the customer feedback,general_quirky,36
daily cases of india,covid_cases,19
What do you call me?,currenthumanquery,20
i would be happy if you update me the events going on our area,recommendation_events,80
Can you recommend some places nearby?,places_near_me,64
it's awfully dark here,iot_hue_lighton,49
What do you think I am?,currenthumanquery,20
I was not talking to you,nottalking2u,62
best ticket price air plane to chester on the twenty first,transport_ticket,100
Got any gossip,gossip,39
make the speaker volume on maximum,audio_volume_up,8
i want the smart socket off now,iot_wemo_off,51
search for podcasts that cover men's issues,play_podcasts,70
let's play you'll be the keeper and never change position,play_game,66
download youtube video of <name> today,download_youtube_video,23
turn on this socket,iot_wemo_on,52
save the opinion that i just posted to this song,music_likeness,57
Can you recommend some places nearby?,places_near_me,64
get me up in half an hour,alarm_set,2
erase my whole calendar,calendar_remove,10
please speak loud,audio_volume_up,8
hoover the carpets around,iot_cleaning,44
What do your friends call you?,namequery,60
resume harry potter book five,play_audiobook,65
olly please will you shut up.,general_commandstop,29
bring up all the runner lights,iot_hue_lightup,50
any one would be fine for me.,general_dontcare,31
This is Adam,greetingresponse,42
i need to book rajdhani train ticket from mumbai to ahmedabad,transport_ticket,100
order a medium pizza with pepperoni and bacon on its,takeaway_order,91
give me the definition of the word fondle,qa_definition,75
Your real name?,realnamequery,79
Do you know any jokes,jokes,53
turn on hall lights,iot_hue_lighton,49
What do you think I am?,currenthumanquery,20
volume control decrease,volume_control,103
put the playlist on shuffle,music_settings,59
find me a recipe of spaghetti,cooking_recipe,15
please scan my social media and tell me what's happening,social_query,88
what is the day,asking_date,3
what does one have to damage in cream to make butter,cooking_recipe,15
"that's cool,.",general_praise,35
prepare a new list,lists_createoradd,54
It is Bella,greetingresponse,42
please clean my calendar,calendar_remove,10
show me chinese food near me,takeaway_order,91
Clever girl,clever,13
clean my entire calendar,calendar_remove,10
what is the weather today,weather_query,104
what's three plus three hundred and fifty five,qa_maths,77
You are very intelligent,clever,13
Comprendo,understandquery,102
play games of xyz 64 bit,play_games,67
tell me a joke about xenophobia,tell_me_joke,94
volume control mute,volume_control,103
area of north america,qa_factoid,76
how many jokes do you know,general_joke,33
train to athens how to,transport_query,98
are there any accidents on harvard,transport_traffic,101
play games of c,play_games,67
What are your functions?,what_can_you_do,105
turn down the speakers,audio_volume_down,6
hey,greet_and_general_check_in,40
Wasn't meant for you,nottalking2u,62
Comprendo,understandquery,102
what can you do,what_can_you_do,105
Thank you,thanks,96
Can you turn the volume up?,volume_control,103
Can you recommend some places nearby?,places_near_me,64
can you find and tell me the prices of facebook stock,qa_stock,78
Can you mute the volume?,volume_control,103
i am bored today,i_am_bored,43
i need a high volume,audio_volume_up,8
please turn on the lights in my house,iot_hue_lighton,49
turn down the lights in the living room,iot_hue_lightdim,47
play all songs by metallica on shuffle,play_music,68
please activate my vacuum cleaner,iot_cleaning,44
what is the exchange rate of euro today to dirham,qa_currency,74
will you tell me again please.,general_repeat,37
info of rowan atkinson,qa_factoid,76
how many degrees is it in orange tx right now,weather_query,104
i am bored what can i do today with my girlfriend,i_am_bored,43
Tell me a joke,jokes,53
What do your friends call you?,namequery,60
find shoe shopping near my home,recommendation_locations,81
take screenshot of google,take_screenshot,90
yeap get that right.,general_affirm,28
what can i do for fun under dollars around me,recommendation_events,80
switch on the plug,iot_wemo_on,52
good bye,goodbye,38
find all the contacts named john,email_querycontact,26
what do they have going on at young circle this week,recommendation_events,80
fuck off,swearing,89
how do i get from my house to the target along i forty,transport_query,98
start creating a new list,lists_createoradd,54
please keep everything i have on this song,music_likeness,57
say that again.,general_repeat,37
That's helpful,thanks,96
give me the list of the top five safest cars to buy,lists_query,55
can you play my latest audio book,play_audiobook,65
please give me detail of one yen equals dollar,qa_currency,74
make an alarm for four pm,alarm_set,2
change the lights to green,iot_hue_lightchange,46
i want the cheapest train ticket to new york,transport_ticket,100
evaluate today's schedule,lists_query,55
"you are hero, thank you very much.",general_praise,35
move to next section,play_podcasts,70
please clear my calendar,calendar_remove,10
Great thanks! My user is Bella,courtesygreetingresponse,18
download youtube video of minecraft,download_youtube_video,23
Your real name please?,realnamequery,79
can you feel,general_quirky,36
customer service complaint,social_post,87
put an order in for two pizzas from dominoes,takeaway_order,91
give me new york's current time,datetime_query,22
Why not,podbaydoorresponse,73
play tunes,play_radio,71
tell me a joke about birds,general_joke,33
shit,swearing,89
remove all alarms,alarm_remove,1
tell me news day after tomorrow,tell_me_news,95
check internet speed of edge,check_internet_speed,12
good news for economy,tell_me_news,95
remove my calendar event at one pm today,calendar_remove,10
could you please check and confirm that.,general_confirm,30
send email to <name>,send_email,84
yes you've done your understanding correcly.,general_affirm,28
send whatsapp message,send_whatsapp_message,85
Your real name?,realnamequery,79
please send mom an email saying that i can make it next week,email_sendemail,27
could you please book me a taxi going to location,transport_taxi,99
"Thank you, goodbye",courtesygoodbye,16
make it brighter in here,iot_hue_lightup,50
can you just cancel it.,general_commandstop,29
What's your real name?,realnamequery,79
running competitions on the west side,recommendation_events,80
make a taxi booking in uber,transport_taxi,99
make coffee at eight am,iot_coffee,45
who sung this,music_query,58
please tweet the following to radisson hotels customer service,social_post,87
"Thank you, bye",courtesygoodbye,16
how long will it take me to drive to work today,transport_traffic,101
what time does the train leave for chicago,transport_query,98
add this email to a new contact,email_addcontact,24
what time do i have a doctors appointment on the twenty second,calendar_query,9
is my alarm set for tomorrow morning,alarm_query,0
"Thank you, goodbye",courtesygoodbye,16
Great thanks! My user is Bella,courtesygreetingresponse,18
review set alarms,alarm_query,0
Why can you not open the pod bay door,podbaydoorresponse,73
when is my train coming,transport_query,98
Quiet,shutup,86
find me a good wine shop that stock old wines like older than ten years navigate me to that shop,general_quirky,36
How about a joke,jokes,53
confirm i have set an alarm for six am,alarm_query,0
where is a good place to eat cheap pakistani food,recommendation_locations,81
please play forward episode in quantico,play_podcasts,70
i wish i could play video games together,play_game,66
check my last post on instagram,social_query,88
play kishore kumar on youtube,play_on_youtube,69
what is the average speed on main highway,transport_traffic,101
Will you open the pod bay door please,podbaydoor,72
open chess game,play_game,66
please convert nine am cst to est time,datetime_convert,21
you've done that right thank you very much.,general_praise,35
what is a funny joke,general_joke,33
what's around tonight,recommendation_events,80
Any gossip,gossip,39
hey,greet_and_general_check_in,40
can you turn that down,audio_volume_down,6
remember metallica selections for next time,music_likeness,57
screen shot of <name>,take_screenshot,90
turn_down speakers,audio_volume_down,6
bye,goodbye,38
would you confirm the detail.,general_confirm,30
i'd like you to confirm that please.,general_confirm,30
back one episode,play_podcasts,70
what is the weather like now today,asking_weather,5
send whatsapp message,send_whatsapp_message,85
any good fast food items,takeaway_order,91
switch off the power,iot_wemo_off,51
what is the weather like day after tomorrow,asking_weather,5
how long until my takeaway,takeaway_query,92
have i made loss in which stocks,qa_stock,78
move forward ten minutes in this podcast,play_podcasts,70
schedule dinner with sara and jamie,calendar_set,11
tell me what one plus one is,qa_maths,77
send whatsapp message about,send_whatsapp_message,85
please tell me the latest news about the election scenario in our state,news_query,61
You are a very intelligent girl,clever,13
Quiet,shutup,86
cancel wake up calls for this week,alarm_remove,1
what meetings do i have next thursday,calendar_query,9
dim the lights in the kitchen,iot_hue_lightdim,47
what are trending topics on twitter right now,social_query,88
"it does not matter with me, olly.",general_dontcare,31
I want to hear some gossip,gossip,39
Hello,greeting,41
What is your name?,namequery,60
please write up a compliant,social_post,87
what is the song name,music_query,58
is the balloon festival this weekend,calendar_query,9
Great thanks! It is Bella,courtesygreetingresponse,18
resume the two towers audiobook,play_audiobook,65
thanks but this is not the right response.,general_negate,34
fantastic response to the command.,general_affirm,28
movies making money,general_quirky,36
begin a new list,lists_createoradd,54
erase that item from my list,lists_remove,56
What do you call me?,currenthumanquery,20
would not really mind.,general_dontcare,31
good afternoon,goodbye,38
go to www dot metronorth dot com for train tickets,transport_ticket,100
please turn the lights down,iot_hue_lightdim,47
Comprendo,understandquery,102
my all time favorite song is something like this from chainsmokers,music_likeness,57
what is weather today,weather_query,104
i do not really mind for anything.,general_dontcare,31
can you set radio to mute,audio_volume_mute,7
save this post about the song that i just listened to,music_likeness,57
set a classic music,play_music,68
turn off light,iot_hue_lightoff,48
fuck off,swearing,89
tell me about president,tell_me_about,93
confirmed.,general_affirm,28
play bad guy on youtube,play_on_youtube,69
send whatsapp message,send_whatsapp_message,85
describe a workhouse for me,qa_definition,75
i need oranges added to my grocery list,lists_createoradd,54
what all lists are available,lists_query,55
what's the good news?,tell_me_news,95
what is the update on stock market,tell_me_news,95
what is the population of florida,qa_factoid,76
please check the exchange rates of the us dollar vs the euro,qa_currency,74
This is Adam,greetingresponse,42
create new list for baby names,lists_createoradd,54
Thanks,thanks,96
"s1, would you further elaborate to me please.",general_explain,32
i want the coffee machine to make me coffee,iot_coffee,45
play games of xyz 32 bit,play_games,67
play shape of you on youtube today,play_on_youtube,69
How are you doing?,courtesygreeting,17
reserve a taxi,transport_taxi,99
What are the top places nearby?,places_near_me,64
start coffee machine,iot_coffee,45
stock exchange rates,qa_stock,78
Can you open the pod bay door please,podbaydoor,72
what is eastern standard time right noe,datetime_query,22
where can i order takeout,takeaway_query,92
"that does not really matter, olly.",general_dontcare,31
fuck off,swearing,89
does this restaurant only do carryout,takeaway_query,92
mute the living room speakers,audio_volume_mute,7
Will you open the pod bay door please,podbaydoor,72
can you make me a cup of coffee,iot_coffee,45
what is the weather like now day before tomorrow,asking_weather,5
cancel all meetings for today,calendar_remove,10
order a large pepperoni pizza from dominos to go,takeaway_order,91
strongly agreed.,general_affirm,28
what time is it now,asking_time,4
Why not,podbaydoorresponse,73
show me share price of facebook,qa_stock,78
send an email to rohit saying i am busy tomorrow,email_sendemail,27
tell me about yours,tell_me_about,93
what is the price of apple stock today,qa_stock,78
raise the light,iot_hue_lightup,50
prove you have a conscious,selfaware,83
logan,recommendation_movies,82
can you give me train times for ann arbor,transport_query,98
begin vacuuming,iot_cleaning,44
Can you prove you are self-aware,selfaware,83
what's going on with economy,tell_me_news,95
what bands are playing in town this weekend,recommendation_events,80
"s2, i didn't catch up with you.",general_explain,32
