text,intent,labels
mute the settings,audio_volume_mute,7
play games of xxd,play_games,67
call an uberpool to get me at long island bar,transport_taxi,99
what can you do,what_can_you_do,105
Tell me some gossip,gossip,39
lower battery consumption to save setting,music_settings,59
Wasn't for you,nottalking2u,62
Who do you think I am?,currenthumanquery,20
save the information which is provided by aman on this song,music_likeness,57
please turn off my alarm for this evening,alarm_remove,1
tune to pandora,play_radio,71
places near me to eat today,places_near_me,64
what went on in the world today,news_query,61
What do your friends call you?,namequery,60
send whatsapp message,send_whatsapp_message,85
please open chess game i would like to play with you,play_game,66
please make me a coffee using the coffee machine,iot_coffee,45
what alarms will wake me up tomorrow,alarm_query,0
Shut up,shutup,86
please send a voice mail to mr richard office about meting him on first of february twenty seventeen at five pm,email_sendemail,27
Is it going to snow,asking_weather,5
i want to know the result of twenty is to two,qa_maths,77
could you clarify further on what you said now to me please.,general_explain,32
put on the screen the lists i have available,lists_query,55
Hello,greeting,41
Tell me a joke,jokes,53
play kishore kumar on youtube,play_on_youtube,69
set an alarm for seven thirty am,alarm_set,2
i need to hear sound on my speakers,audio_volume_up,8
how many grocery stores are located in my neighborhood,recommendation_locations,81
You are very intelligent,clever,13
good bye,goodbye,38
can you tell me the time in new york,datetime_query,22
I am looking for,tell_me_about,93
whats the stock price of apple,qa_stock,78
mute all responses now,audio_volume_mute,7
Thanks,thanks,96
Why will you not open the pod bay door,podbaydoorresponse,73
doesn't matter with me.,general_dontcare,31
see you,goodbye,38
wake me up at four am,alarm_set,2
"s2, i don't get your words.",general_explain,32
Tell me a joke,jokes,53
show me the demographic growth rate of switzerland in the last ten years,qa_factoid,76
tell me a joke,tell_me_joke,94
hey there,greet_and_general_check_in,40
new scenario time or calendar to new list,lists_createoradd,54
when's mark lanegan's next album out,qa_factoid,76
could you suggest some fun in new york,recommendation_events,80
yes it's excellent.,general_affirm,28
volume control mute,volume_control,103
start the oven,iot_wemo_on,52
what song do i play most,music_query,58
volume control decrease,volume_control,103
play the serial podcast,play_podcasts,70
can you play a game with me,play_game,66
decrease speaker volume,audio_volume_down,6
take out event from calendar,calendar_remove,10
it must be mistake.,general_negate,34
Hello hope you are doing well?,courtesygreeting,17
Can you tell me the time?,timequery,97
what is ten divided by five,qa_maths,77
checkout today set alarm of ten am,alarm_query,0
maximum kilometer to delivery,takeaway_query,92
take screenshot,take_screenshot,90
suggestions for future,general_quirky,36
set reminder for tennis game with peter on sunday at four pm,calendar_set,11
give me the exchange rate between united states dollar and canadian dollar,qa_currency,74
what does a sea lion look like,qa_definition,75
add paav bhaji in menu card,lists_createoradd,54
entertainment news,news_query,61
broadcast the health show from the kitchen,play_radio,71
turn up the light,iot_hue_lightup,50
my new work schedule list,lists_createoradd,54
hello there,greet_and_general_check_in,40
start candy crush,play_game,66
what is today's close of goog,qa_stock,78
mary's contact number,email_querycontact,26
is today march sixth,datetime_query,22
Give me a joke,jokes,53
play games of xxd,play_games,67
volume control decrease,volume_control,103
What could I call you?,namequery,60
take screenshot,take_screenshot,90
Surely you can,podbaydoorresponse,73
"s2, can not get this.",general_explain,32
yes it was perfect.,general_affirm,28
play the jazz station,play_radio,71
volume control increase,volume_control,103
please remove the alarm which i set for today morning,alarm_remove,1
tell me news,tell_me_news,95
send whatsapp message to,send_whatsapp_message,85
i want to see the previous episode,play_podcasts,70
open website linkedin.com,open_website,63
Why can you not open the pod bay door,podbaydoorresponse,73
really wouldn't mind.,general_dontcare,31
Hello,greeting,41
Can you recommend some places nearby?,places_near_me,64
open website quora.com,open_website,63
Hi there,greeting,41
seven times seven,qa_maths,77
continue playing my audiobook,play_audiobook,65
What tasks can you complete?,what_can_you_do,105
Hi there,greeting,41
fuck,swearing,89
give me the details of friend,email_querycontact,26
turn on my son's room plug socket on off,iot_wemo_on,52
how many events on my list,lists_query,55
save my music preferences,music_likeness,57
Wasn't for you,nottalking2u,62
i am bored what can i do,i_am_bored,43
Hola how are you?,courtesygreeting,17
brighten up the lighting,iot_hue_lightup,50
which contact haven't i called in twelve months,email_querycontact,26
Where can I find,tell_me_about,93
Wasn't communicating to you,nottalking2u,62
start robot cleaner,iot_cleaning,44
i am bored what can i do today with my friends,i_am_bored,43
What can you assist me with?,what_can_you_do,105
please check and confirm detail.,general_confirm,30
how much does stock cost in walmart,qa_stock,78
bring up lights,iot_hue_lightup,50
play let me love you on youtube,play_on_youtube,69
would not care.,general_dontcare,31
Tell me some gossip,gossip,39
latest instagram posts,social_query,88
twat,swearing,89
Where should I go nearby?,places_near_me,64
are there any meetings set for next wednesday,calendar_query,9
turn corner light on,iot_hue_lighton,49
usa today headlines,news_query,61
Do you get me,understandquery,102
tomorrow,asking_date,3
please activate my coffee pot for me,iot_coffee,45
inform me about the most popular rom com movie playing now in theatres across new york,recommendation_movies,82
i want exact time in washington right now,datetime_query,22
set an alarm for tomorrow at six in the morning,alarm_set,2
locate the email to giant eagle and put it into my contact list,email_addcontact,24
I was not talking to you,nottalking2u,62
Who are you talking to?,currenthumanquery,20
Who are you talking to?,currenthumanquery,20
how do i cook a medium rare steak,cooking_recipe,15
tell me about today,tell_me_about,93
"nope, incorrect command.",general_negate,34
what is starbuck's stock worth,qa_stock,78
hey ms the email address of john miller,email_querycontact,26
is the road in some particular area wide or narrow,transport_traffic,101
what's rene phone number,email_querycontact,26
send email to dipesh,send_email,84
what's the news in politics,news_query,61
sorry but i think you got it wrongly.,general_negate,34
do i have any meetings on friday's afternoon,calendar_query,9
next episode in podcast,play_podcasts,70
remove my list of contacts from work,lists_remove,56
would you please shut down.,general_commandstop,29
good afternoon,goodbye,38
answer the equation eight times seven,qa_maths,77
Tell me a joke,jokes,53
What do you call me?,currenthumanquery,20
turn up,audio_volume_up,8
start the oven,iot_wemo_on,52
tweet to amazon about late delivery of my tv,social_post,87
play rohan sharma podcast for me,play_podcasts,70
click selfie,click_photo,14
raise your volume,audio_volume_up,8
i like a song sing by arijit singh,music_likeness,57
What is the weather like today,asking_weather,5
i want you check the last thing i said please.,general_confirm,30
add new email to anna,email_addcontact,24
how do i cook a meatloaf,cooking_recipe,15
"Thank you, bye",courtesygoodbye,16
what does a baguette look like,qa_definition,75
email my favourite contacts,email_sendemail,27
What actions can you perform?,what_can_you_do,105
i want to know the procedure of making thanksgiving turkey in five sentences,cooking_recipe,15
Can you tell me the time?,timequery,97
tell me about my family,tell_me_about,93
take screenshot of google,take_screenshot,90
book uber taxi for my travel,transport_taxi,99
what is four plus four,qa_maths,77
Hello there,greeting,41
who recently posted on social media,social_query,88
use google to show me how to cook,cooking_recipe,15
send email to <name>,send_email,84
olly will you stop it.,general_commandstop,29
do i have free time next tuesday to schedule a meeting,calendar_query,9
What do you think I am?,currenthumanquery,20
click photo of <name>,click_photo,14
what time is the train to san francisco due,transport_query,98
tell me news day after tomorrow,tell_me_news,95
add valia's wedding the next saturday at eight o clock,calendar_set,11
tell joke,general_joke,33
Genious,clever,13
forward email,email_sendemail,27
Tell me a joke,jokes,53
turn off any morning alarms after friday,alarm_remove,1
Give me a joke,jokes,53
Do you know what time it is?,timequery,97
how do i get the answer to two plus two,qa_maths,77
shuffle song,music_settings,59
inbox my family,email_sendemail,27
send whatsapp message about <name>,send_whatsapp_message,85
Do you understand what I am saying,understandquery,102
Do you know what I am saying,understandquery,102
Clever girl,clever,13
Do you get me,understandquery,102
what's the date is currently,datetime_query,22
how long do i need to cook a brisket for it to be medium,cooking_recipe,15
switch on smart plug,iot_wemo_on,52
tell me a joke about the moon,tell_me_joke,94
order a latte from starbucks,iot_coffee,45
"appreciated, that's nice.",general_praise,35
Do you understand what I am saying,understandquery,102
Hello,greeting,41
delete the last list,lists_remove,56
Tell me some more gossip,gossip,39
nice music,music_likeness,57
what does settle mean,qa_definition,75
volume down,audio_volume_down,6
play chess with me please,play_game,66
thirteenth june is a day of election result please set it,calendar_set,11
"you are smart, olly.",general_praise,35
daily cases of india,covid_cases,19
My user is Adam,greetingresponse,42
could you please cancel my train ticket,transport_ticket,100
show me what i can do with fitness,general_quirky,36
Will you open the pod bay door,podbaydoor,72
What can you assist me with?,what_can_you_do,105
play me news radio channel,play_radio,71
Your real name?,realnamequery,79
please remove my next event,calendar_remove,10
keep playing war and peace,play_audiobook,65
put the disco lights on,iot_hue_lighton,49
Can you prove you are self-aware,selfaware,83
start vacuuming now please,iot_cleaning,44
You are very intelligent,clever,13
locate nearby dining places,recommendation_locations,81
play bad guy on youtube,play_on_youtube,69
I am Bella,greetingresponse,42
display exchange rate of euro to indian rupee,qa_currency,74
take screenshot,take_screenshot,90
can you please explain more on last sentence to me.,general_explain,32
twat,swearing,89
show local events near me,recommendation_events,80
twat,swearing,89
Do you understand what I am saying,understandquery,102
Hola how are you?,courtesygreeting,17
political news of importance for the day,news_query,61
yeah you have gotten my instructions perfectly.,general_affirm,28
which shops can i find in milan,recommendation_locations,81
send whatsapp message,send_whatsapp_message,85
check all the new them emails and mark them star,email_query,25
please play me a song from my favourite list,play_music,68
go to the station fm ninety six point five,play_radio,71
please remove this alarm,alarm_remove,1
Great thanks! I am Bella,courtesygreetingresponse,18
check and confirm that please.,general_confirm,30
set an alarm for the dance classes two hours before the classes start,alarm_set,2
What is your real name please?,realnamequery,79
what's going on facebook,social_query,88
how much is us dollar against rupee,qa_currency,74
hey there,greet_and_general_check_in,40
record the opinion of each individual about this song,music_likeness,57
can you pull up jeff,email_querycontact,26
Do you see anyone in the camera?,whoami,106
Great thanks! It is Bella,courtesygreetingresponse,18
the joke of the day,general_joke,33
turn off the wemo socket in the kitchen,iot_wemo_off,51
would you please check that.,general_confirm,30
i want to hear this week's midweek motorsport,play_radio,71
hey there,greet_and_general_check_in,40
download youtube video of minecraft,download_youtube_video,23
send email to dipesh,send_email,84
show me events nearby,recommendation_events,80
do i have the contact of tara john,email_querycontact,26
Hello hope you are doing well?,courtesygreeting,17
start the oven,iot_wemo_on,52
Hello,greeting,41
download youtube video of <name>,download_youtube_video,23
please dim the overhead lights,iot_hue_lightdim,47
mute the volume,audio_volume_mute,7
what is the day,asking_date,3
could you tell me again please.,general_repeat,37
capture photo of <name>,click_photo,14
good afternoon,goodbye,38
I want to hear some gossip,gossip,39
covid cases of india,covid_cases,19
i want the lights less brighter,iot_hue_lightdim,47
how much is starbuck's stock these days,qa_stock,78
what the conversion rate from yen to us dollars,qa_currency,74
Shut up,shutup,86
set up uber,transport_taxi,99
tell the latest news about the trump,news_query,61
recommend pub in eighth and monte diablo,recommendation_locations,81
Any gossip,gossip,39
what is a good way to make steak,cooking_recipe,15
cancel sam's party,calendar_remove,10
clear list things to do this weekend,lists_remove,56
check the news,news_query,61
open up contacts and add email something@gmail dot com,email_addcontact,24
from wangs kitchen restaurant home delivery for a chicken manchow soup,takeaway_order,91
does chinese deliver,takeaway_query,92
check internet speed of safari,check_internet_speed,12
please check last thing i said.,general_confirm,30
what's good news,tell_me_news,95
send email to,send_email,84
play radio station,play_radio,71
this is not what i requested.,general_negate,34
yes you have done that exactly.,general_affirm,28
remove all alarms set today,alarm_remove,1
Your real name please?,realnamequery,79
What can I call you?,namequery,60
make my collection mostly pop with a good bit of psychedelia,play_music,68
please slow down volume of speaker,audio_volume_down,6
Why can you not open the pod bay door,podbaydoorresponse,73
Wasn't communicating to you,nottalking2u,62
what does it mean to be overbearing,qa_definition,75
i need the current dart rail schedule from west irving station to north lake college,transport_ticket,100
make the lights off,iot_hue_lightoff,48
Hello how are you?,courtesygreeting,17
please cancel my next hair cut,calendar_remove,10
what time is it day before tomorrow,asking_time,4
what does joke mean,qa_definition,75
Can you tell me the time?,timequery,97
i dont want to carry an umbrella will we have rain today,weather_query,104
Who are you talking to?,currenthumanquery,20
you have done that right appreciated.,general_praise,35
send a tweet to national grid,social_post,87
whats with my dinner order,takeaway_query,92
capture photo of,click_photo,14
what time is it tomorrow,asking_time,4
turn off the wemo plug,iot_wemo_off,51
get local events,recommendation_events,80
cancel alarm for tomorrow,alarm_remove,1
journal entry for today,general_quirky,36
play football match for myself now,play_game,66
send email,send_email,84
call me a cab,transport_taxi,99
can you check my last question.,general_confirm,30
Who am I please,whoami,106
am i busy on wednesday evening,calendar_query,9
does that restaurant allow take out orders,takeaway_query,92
lights out,iot_hue_lighton,49
Why,podbaydoorresponse,73
Tell me your name?,namequery,60
turn off my wemo plug socket now,iot_wemo_off,51
tell me a dad joke,tell_me_joke,94
repeat the song playing now,music_settings,59
Tell me some more gossip,gossip,39
show me today train time of kalka at jodhpur,transport_query,98
Can you prove you have a conscious,selfaware,83
can you add gloria to my list of clients,lists_createoradd,54
Do you know what time it is?,timequery,97
What can I call you?,namequery,60
fast and the furious,recommendation_movies,82
OK thank you,thanks,96
shut off the socket,iot_wemo_off,51
Tell me some gossip,gossip,39
time,asking_time,4
can i get delivery from here,takeaway_query,92
play games of xxd,play_games,67
what is the weather like now,asking_weather,5
check internet speed of firefox 64,check_internet_speed,12
places near me to eat today with my friends,places_near_me,64
OK thank you,thanks,96
click photo,click_photo,14
see you later,goodbye,38
is the alarm set for tomorrow morning,alarm_query,0
i want to find some chinese food what is near me,recommendation_locations,81
play despacito on youtube today,play_on_youtube,69
can you turn off on the wemo plug socket,iot_wemo_off,51
is there anything happening in town this weekend,recommendation_events,80
start the smart plug,iot_wemo_on,52
tell me a dad joke,tell_me_joke,94
send email to,send_email,84
light off,iot_hue_lightoff,48
please do not talk for thirty minutes,audio_volume_mute,7
places near me to eat today,places_near_me,64
have i got any alarms set,alarm_query,0
i was not clear about what you just said now.,general_explain,32
What's your real name?,realnamequery,79
please turn on all the outdoor lights,iot_hue_lighton,49
Why can you not open the pod bay door,podbaydoorresponse,73
channel seventy two point five,play_radio,71
Can you tell me the time?,timequery,97
how old is tom hanks,qa_factoid,76
replay my last played podcast,play_podcasts,70
send email to dipesh,send_email,84
hi how are you,greet_and_general_check_in,40
"s1, again explain to me please.",general_explain,32
recommend a movie which is released last friday,recommendation_movies,82
How are you?,courtesygreeting,17
put the disco lights on,iot_hue_lighton,49
This is Adam,greetingresponse,42
switch off the light,iot_hue_lightoff,48
Do you understand what I am saying,understandquery,102
play games of c,play_games,67
play on youtube,play_on_youtube,69
play <song> on youtube,play_on_youtube,69
click selfie of,click_photo,14
Quiet,shutup,86
play let me love you on youtube,play_on_youtube,69
please show me the local weather,weather_query,104
please set my alarm for five pm,alarm_set,2
tell me a joke about xenophobia,tell_me_joke,94
change the lights to red,iot_hue_lightchange,46
what would be the exchange rate of currency in japan,qa_currency,74
please change the color of my lights surprise me,iot_hue_lightchange,46
tell me news day after tomorrow,tell_me_news,95
This is Adam,greetingresponse,42
tell me whats on the web,social_query,88
make a room darker,iot_hue_lightdim,47
What do you call me?,currenthumanquery,20
send an email to fred from work he is in my contacts,email_sendemail,27
take screenshot,take_screenshot,90
may i know the traffic situation,transport_traffic,101
Do you understand what I am saying,understandquery,102
download youtube video hd of,download_youtube_video,23
check internet speed of <name>,check_internet_speed,12
play podcast one,play_podcasts,70
Do you get me,understandquery,102
play the next episode of this series,play_podcasts,70
screen shot of <name>,take_screenshot,90
search for gluten free menus,cooking_recipe,15
Can you recommend some places nearby?,places_near_me,64
change the time zone from irish time zone to moscow time zone,datetime_convert,21
tell me a fun joke,tell_me_joke,94
what is the weather tomorrow,asking_weather,5
hi olly change the color of lights in my room to red,iot_hue_lightchange,46
Good thanks! My user is Adam,courtesygreetingresponse,18
whats up,greet_and_general_check_in,40
yeah amazing response.,general_affirm,28
what is the time in india when the time in us is twelve pm,datetime_convert,21
Can you prove you are self aware please,selfaware,83
check internet speed of opera,check_internet_speed,12
what's the temperature,weather_query,104
"it's amazing job, thank you very much, olly.",general_praise,35
can you please turn up the lights,iot_hue_lightup,50
play baseball net,play_games,67
send email about <name>,send_email,84
"Thanks for the help, goodbye",courtesygoodbye,16
erase my appointment on the twelfth from my calendar,calendar_remove,10
inform me of my new emails,email_query,25
tell me about my job,tell_me_about,93
i saw a bulldog today,general_quirky,36
please play program on xmtune,play_radio,71
twat,swearing,89
Can you tell me the time?,timequery,97
i wouldn't really mind.,general_dontcare,31
how is jennifer garner's career doing,qa_factoid,76
pull up lights control,iot_hue_lightup,50
bed room two lights off,iot_hue_lightoff,48
i need directions to lowes in mount h nj,transport_query,98
play keno,play_game,66
can you remove that on my calendar,calendar_remove,10
hey there,greet_and_general_check_in,40
turn off wemo plug in game room,iot_wemo_off,51
please create a new alarm,alarm_set,2
convert eight thirty from gtm four to g. m. t. five thirty,datetime_convert,21
it is dark,iot_hue_lighton,49
what is the day,asking_date,3
Any gossip,gossip,39
put on the vacuum on now and clean the living room,iot_cleaning,44
could you clarify me on it further.,general_explain,32
I was not talking to you,nottalking2u,62
what is the day of the week,asking_date,3
how do i make meal,cooking_recipe,15
Quiet,shutup,86
directions to virginia beach va,transport_query,98
hey,greet_and_general_check_in,40
What are the things you can do?,what_can_you_do,105
start spider,play_game,66
download youtube video of <name>,download_youtube_video,23
play songs by adele,play_music,68
what playlist is on shuffle,music_query,58
will you retry it please.,general_repeat,37
raise the volume of the speakers to fifty five percent,audio_volume_up,8
could you speak the last utterance said once more.,general_repeat,37
"Thank you, goodbye",courtesygoodbye,16
Why not,podbaydoorresponse,73
what is the weather like day before tomorrow,asking_weather,5
Tell me a joke,jokes,53
what is the definition of inchoate,qa_definition,75
add my car payment on the twelfth in my calendar,calendar_set,11
respond to all that i am on my way,email_sendemail,27
i am bored today what can i do,i_am_bored,43
Great thanks! It is Bella,courtesygreetingresponse,18
let's play our favourite football match on tv,play_game,66
time,asking_time,4
Got any gossip,gossip,39
What can I call you?,namequery,60
how far is orlando from my house,transport_query,98
add new email to contacts,email_addcontact,24
play music now from radio plus,play_radio,71
Where should I go nearby?,places_near_me,64
is it going to rain in the next few days in tucson,weather_query,104
turn off my alarm,alarm_remove,1
OK thank you,thanks,96
set an alarm for ten o'clock tomorrow morning,alarm_set,2
what events are scheduled for this weekend in me area,recommendation_events,80
tell me lexmark's current stock price,qa_stock,78
if you put a velociraptor and a hippo together what would happen,general_quirky,36
start playing fm ninety six point five when it is one pm,play_radio,71
i want to hear the latest podcast episode of s town,play_podcasts,70
help me find transportation to the mall of america,transport_taxi,99
decrease volume to very soft,audio_volume_down,6
what movie theatres are in stephenville,recommendation_movies,82
Surely you can,podbaydoorresponse,73
what time is it tomorrow,asking_time,4
where is the closest spot to order food for pickup,takeaway_query,92
Thanks good bye,courtesygoodbye,16
instructions to make a meal,cooking_recipe,15
turn on plug,iot_wemo_on,52
covid cases of india past 24 hours,covid_cases,19
fuck,swearing,89
"wouldn't mind to select any one, olly.",general_dontcare,31
find a taxi to go home,transport_taxi,99
what is the time in hyderabad,datetime_query,22
change the time in this location to ist,datetime_convert,21
hi how are you,greet_and_general_check_in,40
set the coffee maker to on,iot_coffee,45
find the serial podcast and play it,play_podcasts,70
find me someone,email_querycontact,26
please lower the shuffle rate of hips don't lie,music_settings,59
i need some ambiance please,iot_hue_lightchange,46
Wasn't for you,nottalking2u,62
put working out on my calendar for eight am every day this week,calendar_set,11
set my alarm for eight am,alarm_set,2
"Thank you, bye",courtesygoodbye,16
save my song preferences on playlist,music_likeness,57
yeah you've got my instructions right.,general_affirm,28
Why will you not open the pod bay door,podbaydoorresponse,73
Great thanks! It is Bella,courtesygreetingresponse,18
"you are my hero, thank you so much, olly.",general_praise,35
what highly rated movies are playing this weekend,recommendation_movies,82
how do i make meatloaf,cooking_recipe,15
dim lights in living room,iot_hue_lightdim,47
what are the results of the election,news_query,61
further elaborate me on what you have said please.,general_explain,32
show me today all train times of next two hours at jodhpur to pali,transport_query,98
play games of c,play_games,67
send email to <name>,send_email,84
download youtube video of,download_youtube_video,23
How about a joke,jokes,53
send whatsapp message,send_whatsapp_message,85
tell me a joke about xenophobia,tell_me_joke,94
find me the recipe for a cake,cooking_recipe,15
can i get a taxi to come to my house in an hour,transport_taxi,99
turn on this socket,iot_wemo_on,52
what is the forecast,weather_query,104
please could you confirm instruction.,general_confirm,30
find my food,takeaway_query,92
put the disco lights on,iot_hue_lighton,49
tell me the temperature in pheonix,weather_query,104
"Thank you, goodbye",courtesygoodbye,16
give me the description of a smartphone circuit,qa_definition,75
Tell me some gossip,gossip,39
set mute mode for one hour,audio_volume_mute,7
please solve this math,qa_maths,77
would you please check and confirm what i last said.,general_confirm,30
"it is great one, thank you.",general_praise,35
when is the next lakers game,qa_factoid,76
open website stackoverflow.com,open_website,63
cup of coffee please,iot_coffee,45
